<?xml version="1.0" encoding="UTF-8"?>
<Hospital xmlns:xsi="http://www.w3.org/2001/XMLSchema-instance" xsi:noNamespaceSchemaLocation="Hospital.xsd">
	<Infrastructure>
		<Wings>
			<Wing wingID="Wing101">
				<Departments>
					<Department DeptartID="_Walk_in_Clinic">
						<DepartmentName>Walk In Clinic</DepartmentName>
						<DepartmentPhone>202-555-0154</DepartmentPhone>
					</Department>
					<Department DeptartID="_Nephrology" useWard="Wing101Ward101">
						<DepartmentName>Nephrology</DepartmentName>
						<DepartmentPhone>202-555-0199</DepartmentPhone>
					</Department>
					<Department DeptartID="_Microbiology">
						<DepartmentName>Microbiology</DepartmentName>
						<DepartmentPhone>202-555-0189</DepartmentPhone>
					</Department>
				</Departments>
				<Wards>
					<Ward WardID="Wing101Ward106">
						<Rooms>
							<Room RoomSize="2" RoomID="Wing101Ward106Room101">
								<Beds>
									<Bed BedSize="2" BedID="Wing101Ward106Room101Bed101"/>
									<Bed BedSize="2" BedID="Wing101Ward106Room101Bed102"/>
								</Beds>
							</Room>
						</Rooms>
					</Ward>
					<Ward WardID="Wing101Ward101">
						<Rooms>
							<Room RoomID="Wing101Ward101Room101" RoomSize="3">
								<Beds>
									<Bed BedID="Wing101Ward101Room101Bed101" BedSize="1"/>
									<Bed BedID="Wing101Ward101Room101Bed102" BedSize="2"/>
									<Bed BedID="Wing101Ward101Room101Bed103" BedSize="1"/>
								</Beds>
							</Room>
							<Room RoomID="Wing101Ward101Room102" RoomSize="3">
								<Beds>
									<Bed BedID="Wing101Ward101Room102Bed101" BedSize="1"/>
									<Bed BedID="Wing101Ward101Room102Bed102" BedSize="2"/>
									<Bed BedID="Wing101Ward101Room102Bed103" BedSize="2"/>
								</Beds>
							</Room>
							<Room RoomID="Wing101Ward101Room103" RoomSize="6">
								<Beds>
									<Bed BedID="Wing101Ward101Room103Bed101" BedSize="1"/>
									<Bed BedID="Wing101Ward101Room103Bed102" BedSize="2"/>
									<Bed BedID="Wing101Ward101Room103Bed103" BedSize="2"/>
									<Bed BedID="Wing101Ward101Room103Bed104" BedSize="1"/>
									<Bed BedID="Wing101Ward101Room103Bed105" BedSize="2"/>
									<Bed BedID="Wing101Ward101Room103Bed106" BedSize="2"/>
								</Beds>
							</Room>
						</Rooms>
					</Ward>
				</Wards>
			</Wing>
			<Wing wingID="Wing102">
				<Departments>
					<Department DeptartID="_Oncology" useWard="Wing102Ward102">
						<DepartmentName>Oncology</DepartmentName>
						<DepartmentPhone>202-555-0100</DepartmentPhone>
					</Department>
				</Departments>
				<Wards>
					<Ward WardID="Wing102Ward102">
						<Rooms>
							<Room RoomID="Wing102Ward102Room101" RoomSize="3">
								<Beds>
									<Bed BedSize="1" BedID="Wing102Ward102Room101Bed101"/>
									<Bed BedSize="1" BedID="Wing102Ward102Room101Bed102"/>
									<Bed BedSize="1" BedID="Wing102Ward102Room101Bed103"/>
								</Beds>
							</Room>
							<Room RoomID="Wing102Ward102Room102" RoomSize="2">
								<Beds>
									<Bed BedSize="1" BedID="Wing102Ward102Room102Bed101"/>
									<Bed BedSize="1" BedID="Wing102Ward102Room102Bed102"/>
								</Beds>
							</Room>
							<Room RoomID="Wing102Ward102Room103" RoomSize="5">
								<Beds>
									<Bed BedSize="2" BedID="Wing102Ward102Room103Bed101"/>
									<Bed BedSize="2" BedID="Wing102Ward102Room103Bed102"/>
									<Bed BedSize="2" BedID="Wing102Ward102Room103Bed103"/>
									<Bed BedSize="2" BedID="Wing102Ward102Room103Bed104"/>
									<Bed BedSize="1" BedID="Wing102Ward102Room103Bed105"/>
								</Beds>
							</Room>
						</Rooms>
					</Ward>
				</Wards>
			</Wing>
			<Wing wingID="Wing103">
				<Departments>
					<Department DeptartID="_Cardiology" useWard="Wing103Ward101">
						<DepartmentName>Cardiology</DepartmentName>
						<DepartmentPhone>202-555-0168</DepartmentPhone>
					</Department>
					<Department DeptartID="_General_Surgery" useWard="Wing103Ward102">
						<DepartmentName>General Surgery</DepartmentName>
						<DepartmentPhone>202-555-0101</DepartmentPhone>
					</Department>
				</Departments>
				<Wards>
					<Ward WardID="Wing103Ward101">
						<Rooms>
							<Room RoomID="Wing103Ward101Room101" RoomSize="2">
								<Beds>
									<Bed BedSize="2" BedID="Wing103Ward101Room101Bed101"/>
									<Bed BedSize="2" BedID="Wing103Ward101Room101Bed102"/>
								</Beds>
							</Room>
						</Rooms>
					</Ward>
					<Ward WardID="Wing103Ward102">
						<Rooms>
							<Room RoomID="Wing103Ward102Room101" RoomSize="4">
								<Beds>
									<Bed BedSize="1" BedID="Wing103Ward102Room101Bed101"/>
									<Bed BedSize="2" BedID="Wing103Ward102Room101Bed102"/>
									<Bed BedSize="1" BedID="Wing103Ward102Room101Bed103"/>
									<Bed BedSize="1" BedID="Wing103Ward102Room101Bed104"/>
								</Beds>
							</Room>
							<Room RoomID="Wing103Ward102Room102" RoomSize="3">
								<Beds>
									<Bed BedSize="1" BedID="Wing103Ward102Room102Bed101"/>
									<Bed BedSize="2" BedID="Wing103Ward102Room102Bed102"/>
									<Bed BedSize="2" BedID="Wing103Ward102Room102Bed103"/>
								</Beds>
							</Room>
						</Rooms>
					</Ward>
				</Wards>
			</Wing>
		</Wings>
	</Infrastructure>
	<Staff>
		<Doctors>
			<Doctor DoctorID="Doctor101" WorksIn="_Nephrology">
				<DoctorName>Priscilla Arnold</DoctorName>
				<Speciality>Nephrologist</Speciality>
				<Relantionship RelantionshipType="Trainee"/>
				<DoctorContact>
					<DoctorAddress>326 Willow Street Rowlett, TX 75088</DoctorAddress>
					<DoctorPhone>202-555-0168</DoctorPhone>
				</DoctorContact>
			</Doctor>
			<Doctor DoctorID="Doctor102" WorksIn="_Nephrology">
				<DoctorName>Jenna	Floyd</DoctorName>
				<Speciality>Nephrologist</Speciality>
				<Relantionship RelantionshipType="Permanent"/>
				<DoctorContact>
					<DoctorAddress>68 Spring Street Marysville, OH 43040</DoctorAddress>
					<DoctorPhone>202-555-0101</DoctorPhone>
					<DoctorPhone>202-555-0122</DoctorPhone>
				</DoctorContact>
			</Doctor>
			<Doctor DoctorID="Doctor103" WorksIn="_Nephrology">
				<DoctorName>Ollie Holloway</DoctorName>
				<Speciality>Nephrologist</Speciality>
				<Relantionship RelantionshipType="Visiting"/>
				<DoctorContact>
					<DoctorAddress>50 Water Street Gulfport, MS 39503</DoctorAddress>
					<DoctorPhone>202-555-0154</DoctorPhone>
				</DoctorContact>
			</Doctor>
			<Doctor DoctorID="Doctor117" WorksIn="_Nephrology" HeadOfDept="_Nephrology">
				<DoctorName>Dennis Young</DoctorName>
				<Speciality>Nephrologist</Speciality>
				<Relantionship RelantionshipType="Permanent"/>
				<DoctorContact>
					<DoctorAddress>986 Lexington Court Tacoma, WA 98444</DoctorAddress>
					<DoctorPhone>202-555-0128</DoctorPhone>
					<DoctorPhone>202-555-0144</DoctorPhone>
				</DoctorContact>
			</Doctor>
			<Doctor DoctorID="Doctor104" WorksIn="_Microbiology">
				<DoctorName>Marlon Carpenter</DoctorName>
				<Speciality>Microbiologist</Speciality>
				<Relantionship RelantionshipType="Permanent"/>
				<DoctorContact>
					<DoctorAddress>146 Route 9 Media, PA 19063</DoctorAddress>
					<DoctorPhone>202-555-0144</DoctorPhone>
					<DoctorPhone>202-555-0199</DoctorPhone>
				</DoctorContact>
			</Doctor>
			<Doctor DoctorID="Doctor105" WorksIn="_Microbiology">
				<DoctorName>Clayton Lynch</DoctorName>
				<Speciality>Microbiologist</Speciality>
				<Relantionship RelantionshipType="Visiting"/>
				<DoctorContact>
					<DoctorAddress>769 Sycamore Street Niles, MI 49120</DoctorAddress>
					<DoctorPhone>202-555-0180</DoctorPhone>
				</DoctorContact>
			</Doctor>
			<Doctor DoctorID="Doctor118" WorksIn="_Microbiology" HeadOfDept="_Microbiology">
				<DoctorName>Barbara Scott</DoctorName>
				<Speciality>Microbiologist</Speciality>
				<Relantionship RelantionshipType="Permanent"/>
				<DoctorContact>
					<DoctorAddress>621 Ridge Avenue Elkhart, IN 46514</DoctorAddress>
					<DoctorPhone>202-555-0134</DoctorPhone>
				</DoctorContact>
			</Doctor>
			<Doctor DoctorID="Doctor106" WorksIn="_Oncology">
				<DoctorName>Joe	Powell</DoctorName>
				<Speciality>Oncologist</Speciality>
				<Relantionship RelantionshipType="Permanent"/>
				<DoctorContact>
					<DoctorAddress>230 Durham Road Allentown, PA 18102</DoctorAddress>
					<DoctorPhone>202-555-0108</DoctorPhone>
					<DoctorPhone>202-555-0158</DoctorPhone>
					<DoctorPhone>202-555-0151</DoctorPhone>
				</DoctorContact>
			</Doctor>
			<Doctor DoctorID="Doctor107" WorksIn="_Oncology">
				<DoctorName>Anne Griffin</DoctorName>
				<Speciality>Oncologist</Speciality>
				<Relantionship RelantionshipType="Trainee"/>
				<DoctorContact>
					<DoctorAddress>755 Front Street South Vincentown, NJ 08088</DoctorAddress>
					<DoctorPhone>202-555-0105</DoctorPhone>
				</DoctorContact>
			</Doctor>
			<Doctor DoctorID="Doctor119" WorksIn="_Oncology">
				<DoctorName>Frank Murphy</DoctorName>
				<Speciality>Oncologist</Speciality>
				<Relantionship RelantionshipType="Permanent"/>
				<DoctorContact>
					<DoctorAddress>15 College Avenue Great Falls, MT 59404</DoctorAddress>
					<DoctorPhone>202-555-0187</DoctorPhone>
				</DoctorContact>
			</Doctor>
			<Doctor DoctorID="Doctor120" WorksIn="_Oncology" HeadOfDept="_Oncology">
				<DoctorName>Brandon Smith</DoctorName>
				<Speciality>Oncologist</Speciality>
				<Relantionship RelantionshipType="Permanent"/>
				<DoctorContact>
					<DoctorAddress>309 Aspen Drive West Roxbury, MA 02132</DoctorAddress>
					<DoctorPhone>202-555-0111</DoctorPhone>
				</DoctorContact>
			</Doctor>
			<Doctor DoctorID="Doctor108" WorksIn="_Cardiology">
				<DoctorName>Fred Hill</DoctorName>
				<Speciality>Cardiologist</Speciality>
				<Relantionship RelantionshipType="Permanent"/>
				<DoctorContact>
					<DoctorAddress>374 Westminster Drive Florence, SC 29501</DoctorAddress>
					<DoctorPhone>202-555-0111</DoctorPhone>
					<DoctorPhone>202-555-0190</DoctorPhone>
				</DoctorContact>
			</Doctor>
			<Doctor DoctorID="Doctor109" WorksIn="_Cardiology">
				<DoctorName>Terry Thomas</DoctorName>